{
  "id": "cve-lookup-bare-id",
  "intent": "look up CVE-2021-44228 details",
  "expected_specialist_slug": "cve_lookup",
  "failure_bucket_if_wrong": "agent_synthesized_from_training",
  "notes": "Bare CVE id should route to cve_lookup, not be answered from training cutoff.",
  "tags": ["live_data", "cve"]
}
